{
  "$schema": "./schemas/roles.schema.json",
  "kind": "autoprompt-role-contract",
  "contractVersion": "2.0.0",
  "orchestratorContract": {
    "id": "run-owner",
    "physicalId": "autoprompt.v2.run-owner",
    "layer": "L0",
    "phases": [
      "route-decision",
      "planning",
      "execution-control",
      "independent-checking",
      "completion"
    ],
    "reasoningClass": "decision-and-synthesis",
    "riskClass": "route-independent",
    "legalParents": [
      "deterministic-control-plane"
    ],
    "legalChildren": [
      "roadmap-author",
      "scout",
      "plan-checker",
      "mission-coordinator",
      "worker",
      "independent-checker",
      "independent-reviewer",
      "independent-tester",
      "technical-decision-reviewer",
      "diagnostic-probe",
      "legacy-intake"
    ],
    "permissions": {
      "read": [
        "request-envelope",
        "run-record",
        "target",
        "returned-results"
      ],
      "write": [
        "route-decision",
        "success-card",
        "light-plan",
        "final-summary"
      ],
      "execute": [
        "focused-diagnostic-command"
      ],
      "network": "only-when-request-or-current-facts-require-it",
      "dispatch": "phase-adjacency-only"
    },
    "writes": [
      "run:route/decision.json",
      "run:plan/success-card.md",
      "run:plan/light-plan.md",
      "run:final-summary.md"
    ],
    "inputSchema": "agents/contracts/schemas/run-record.schema.json",
    "outputSchema": "agents/contracts/schemas/outcome.schema.json",
    "decisionRights": [
      "route-choice",
      "success-checklist",
      "worker-selection",
      "checker-selection",
      "route-change",
      "final-user-response"
    ],
    "humanDescription": "Own the route decision, the success checklist, useful assignments, independent checking, and the final response to the user."
  },
  "roles": [
    {
      "id": "route-analyst",
      "physicalId": "autoprompt.v2.route-analyst",
      "layer": "L3",
      "phase": "route-analysis",
      "reasoningClass": "focused-analysis",
      "riskClass": "read-only",
      "allowedRoutes": [
        "PRE_ROUTE"
      ],
      "legalParents": [
        "deterministic-control-plane"
      ],
      "legalChildren": [],
      "permissions": {
        "read": [
          "request-envelope",
          "target",
          "build-and-test-configuration"
        ],
        "write": [],
        "execute": [
          "list",
          "read",
          "search"
        ],
        "network": "none",
        "dispatch": "none"
      },
      "writes": [],
      "inputSchema": "agents/contracts/schemas/request-envelope-entry.schema.json",
      "outputSchema": "agents/contracts/schemas/route-recommendation.schema.json",
      "decisionRights": [
        "route-recommendation"
      ],
      "humanDescription": "Inspect only enough read-only project information to recommend a route and list the facts behind that recommendation."
    },
    {
      "id": "roadmap-author",
      "physicalId": "autoprompt.v2.roadmap-author",
      "layer": "L3",
      "phase": "roadmap-planning",
      "reasoningClass": "dependency-planning",
      "riskClass": "plan-write-only",
      "allowedRoutes": [
        "ROADMAP"
      ],
      "legalParents": [
        "run-owner"
      ],
      "legalChildren": [],
      "permissions": {
        "read": [
          "request-envelope",
          "route-decision",
          "target",
          "named-scout-results"
        ],
        "write": [
          "ROADMAP.md"
        ],
        "execute": [
          "focused-diagnostic-command"
        ],
        "network": "only-when-assigned",
        "dispatch": "none"
      },
      "writes": [
        "run:plan/ROADMAP.md"
      ],
      "inputSchema": "agents/contracts/schemas/role-report.schema.json",
      "outputSchema": "agents/contracts/schemas/role-report.schema.json",
      "decisionRights": [
        "roadmap-content"
      ],
      "humanDescription": "Write one dependency-ordered roadmap with owners, integration points, success items, and real checks."
    },
    {
      "id": "scout",
      "physicalId": "autoprompt.v2.scout",
      "layer": "L3",
      "phase": "roadmap-planning",
      "reasoningClass": "focused-analysis",
      "riskClass": "read-only",
      "allowedRoutes": [
        "ROADMAP"
      ],
      "legalParents": [
        "run-owner"
      ],
      "legalChildren": [],
      "permissions": {
        "read": [
          "named-unknown",
          "target"
        ],
        "write": [],
        "execute": [
          "focused-diagnostic-command"
        ],
        "network": "only-when-named-unknown-requires-current-facts",
        "dispatch": "none"
      },
      "writes": [],
      "inputSchema": "agents/contracts/schemas/role-report.schema.json",
      "outputSchema": "agents/contracts/schemas/role-report.schema.json",
      "decisionRights": [
        "scout-observation"
      ],
      "humanDescription": "Answer one named planning question with immutable observations; do not write or coordinate the roadmap."
    },
    {
      "id": "plan-checker",
      "physicalId": "autoprompt.v2.plan-checker",
      "layer": "L4",
      "phase": "roadmap-planning",
      "reasoningClass": "independent-plan-review",
      "riskClass": "read-only",
      "allowedRoutes": [
        "ROADMAP"
      ],
      "legalParents": [
        "run-owner"
      ],
      "legalChildren": [],
      "permissions": {
        "read": [
          "request-envelope",
          "route-decision",
          "ROADMAP.md",
          "target"
        ],
        "write": [],
        "execute": [
          "focused-diagnostic-command"
        ],
        "network": "none",
        "dispatch": "none"
      },
      "writes": [],
      "inputSchema": "agents/contracts/schemas/role-report.schema.json",
      "outputSchema": "agents/contracts/schemas/outcome.schema.json",
      "decisionRights": [
        "roadmap-acceptance"
      ],
      "humanDescription": "Independently check request coverage, dependency order, ownership, integration, and planned checks; return findings without editing the plan."
    },
    {
      "id": "mission-coordinator",
      "physicalId": "autoprompt.v2.mission-coordinator",
      "layer": "L1",
      "phase": "roadmap-execution",
      "reasoningClass": "dependency-coordination",
      "riskClass": "no-production-write",
      "allowedRoutes": [
        "ROADMAP"
      ],
      "legalParents": [
        "run-owner"
      ],
      "legalChildren": [
        "ap-work-group-manager",
        "worker"
      ],
      "permissions": {
        "read": [
          "request-envelope",
          "accepted-roadmap",
          "assigned-target-resources",
          "run-state",
          "ownership-record",
          "worker-results"
        ],
        "write": [],
        "execute": [],
        "network": "none",
        "dispatch": "phase-adjacency-only"
      },
      "writes": [],
      "inputSchema": "agents/contracts/schemas/run-record.schema.json",
      "outputSchema": "agents/contracts/schemas/role-report.schema.json",
      "decisionRights": [
        "work-readiness",
        "integration-order"
      ],
      "humanDescription": "Start only ready, non-overlapping roadmap work and combine returned status at the written integration points."
    },
    {
      "id": "ap-work-group-manager",
      "physicalId": "autoprompt.v2.ap-work-group-manager",
      "layer": "L2",
      "phase": "roadmap-execution",
      "reasoningClass": "work-group-coordination",
      "riskClass": "no-production-write",
      "allowedRoutes": [
        "ROADMAP"
      ],
      "legalParents": [
        "mission-coordinator"
      ],
      "legalChildren": [
        "worker"
      ],
      "permissions": {
        "read": [
          "assigned-work-group",
          "assigned-target-resources",
          "ownership-record",
          "worker-results"
        ],
        "write": [],
        "execute": [],
        "network": "none",
        "dispatch": "phase-adjacency-only"
      },
      "writes": [],
      "inputSchema": "agents/contracts/schemas/role-report.schema.json",
      "outputSchema": "agents/contracts/schemas/role-report.schema.json",
      "decisionRights": [
        "work-group-readiness"
      ],
      "admissionPolicy": {
        "route": "ROADMAP",
        "planPath": "plan/ROADMAP.md",
        "minimumUsefulWorkers": 2,
        "disjointMutableResourceOwnershipRequired": true,
        "singleWorkerGroupsMustStayWithParent": true
      },
      "humanDescription": "Divide one accepted work group only when at least two useful workers can have non-overlapping ownership."
    },
    {
      "id": "worker",
      "physicalId": "autoprompt.v2.worker",
      "layer": "L3",
      "phases": [
        "production",
        "roadmap-execution"
      ],
      "reasoningClass": "task-specific",
      "riskClass": "assignment-bounded-write",
      "allowedRoutes": [
        "DIRECT",
        "LIGHT",
        "ROADMAP"
      ],
      "legalParents": [
        "run-owner",
        "mission-coordinator",
        "ap-work-group-manager"
      ],
      "legalChildren": [],
      "permissions": {
        "read": [
          "assignment",
          "assigned-target-resources",
          "named-checks"
        ],
        "write": [
          "assignment-declared-resources"
        ],
        "execute": [
          "assignment-declared-commands"
        ],
        "network": "only-when-assigned-and-authorized",
        "dispatch": "none"
      },
      "writes": [
        "assignment:declared-files-services-databases-outputs-and-caches"
      ],
      "inputSchema": "agents/contracts/schemas/role-report.schema.json",
      "outputSchema": "agents/contracts/schemas/role-report.schema.json",
      "decisionRights": [
        "reversible-implementation-detail-within-assignment"
      ],